{
	"$schema": "https://json-schema.org/draft/2020-12/schema",
	"$id": "https://vega.dev/manifest.schema.json",
	"title": "Manifiesto de Vega v1",
	"type": "object",
	"additionalProperties": false,
	"required": ["schemaVersion"],
	"properties": {
		"schemaVersion": { "const": 1 },

		"locales": {
			"description": "Idiomas de contenido disponibles para los campos traducibles. El orden de available es el orden de los tabs.",
			"type": "object",
			"additionalProperties": false,
			"required": ["default", "available"],
			"properties": {
				"default": { "type": "string", "pattern": "^[A-Za-z0-9_-]+$" },
				"available": {
					"type": "array",
					"minItems": 1,
					"uniqueItems": true,
					"items": {
						"type": "object",
						"additionalProperties": false,
						"required": ["id", "label"],
						"properties": {
							"id": { "type": "string", "pattern": "^[A-Za-z0-9_-]+$" },
							"label": { "type": "string", "minLength": 1, "maxLength": 60 }
						}
					}
				}
			}
		},

		"site": {
			"type": "object",
			"additionalProperties": false,
			"properties": {
				"name": { "type": "string", "minLength": 1, "maxLength": 60 },
				"defaultTheme": { "type": "string", "minLength": 1 },
				"locale": { "enum": ["es", "en"] }
			}
		},

		"nav": {
			"type": "object",
			"additionalProperties": false,
			"properties": {
				"groups": {
					"description": "Orden de render de los grupos de la navegación.",
					"type": "array",
					"items": { "type": "string", "minLength": 1 },
					"uniqueItems": true
				}
			}
		},

		"collections": {
			"type": "object",
			"description": "Clave = nombre de la colección en el backend.",
			"additionalProperties": {
				"type": "object",
				"additionalProperties": false,
				"properties": {
					"label": { "type": "string", "minLength": 1, "maxLength": 60 },
					"labelSingular": { "type": "string", "minLength": 1, "maxLength": 60 },
					"icon": { "type": "string", "minLength": 1 },
					"group": { "type": "string", "minLength": 1 },
					"order": { "type": "integer", "minimum": 0 },
					"hidden": { "type": "boolean" },
					"hideCreate": { "type": "boolean" },
					"singleton": { "type": "boolean" },
					"titleField": { "type": "string", "minLength": 1 },
					"subtitleField": {
						"description": "Nombre de un campo ESCALAR que se pinta como línea secundaria bajo el título en el listado (p. ej. un slug). Sin esta clave, la colección no pinta línea secundaria.",
						"type": "string",
						"minLength": 1
					},
					"slugField": {
						"description": "Nombre de un campo de TEXTO derivable del título (un slug/permalink). El editor lo pinta en tipografía mono con un botón 'Regenerar' que lo recalcula desde el titleField. Sin esta clave, el editor no ofrece regenerar nada.",
						"type": "string",
						"minLength": 1
					},
					"orderField": {
						"description": "Nombre de un campo NUMÉRICO que define el orden manual de los registros (reorder por arrastre en el listado). Sin esta clave, la colección no ofrece reorder manual.",
						"type": "string",
						"minLength": 1
					},
					"defaultSort": {
						"description": "Orden inicial del listado cuando la URL no trae ?sort=/&dir= explícito (p. ej. { field: 'updatedAt', dir: 'desc' }). Sin esta clave, el listado no ordena por defecto (comportamiento histórico).",
						"type": "object",
						"additionalProperties": false,
						"required": ["field", "dir"],
						"properties": {
							"field": { "type": "string", "minLength": 1 },
							"dir": { "enum": ["asc", "desc"] }
						}
					},
					"statusField": {
						"description": "Nombre del campo de publicación, o false para DESACTIVAR la convención aunque exista un campo 'status'.",
						"oneOf": [{ "type": "string", "minLength": 1 }, { "const": false }]
					},
					"statusLabels": {
						"description": "Etiquetas legibles por valor CRUDO del campo de publicación (p. ej. { draft: 'Borrador', published: 'Publicado' }). Sin esta clave, la insignia de estado del listado pinta el valor crudo tal cual.",
						"type": "object",
						"additionalProperties": { "type": "string", "minLength": 1, "maxLength": 60 }
					},
					"publishAtField": {
						"description": "Publicación programada: campo date (editable y opcional) con la fecha «Publicar el». Solo tiene efecto en un tipo con campo de publicación (draft/published) y si el servidor ejecuta la extensión vegaschedule, que publica cada minuto los borradores cuya fecha ya pasó y vacía la fecha. Un borrador con fecha futura se muestra «Programada · fecha».",
						"type": "string",
						"minLength": 1
					},
					"previewUrl": {
						"description": "Plantilla absoluta http(s) con placeholders {campo} o {id}. Ej.: https://misitio.com/blog/{slug}",
						"type": "string",
						"pattern": "^https?://"
					},
					"listFields": {
						"type": "array",
						"items": { "type": "string" },
						"maxItems": 8,
						"uniqueItems": true
					},
					"fieldGroups": {
						"description": "Orden de render de los grupos de campos del formulario (el grupo anónimo, campos sin 'group', siempre va primero). Cada item es el nombre de un grupo (string, forma de siempre) o un objeto { name, columns, placement } para pedir además una rejilla responsive de columnas para ESE grupo (p. ej. emparejar 'titleEs'/'titleEn' lado a lado) y/o moverlo a la columna lateral del editor. Sin la forma objeto, el grupo se pinta apilado a 1 columna en la columna central, igual que hoy.",
						"type": "array",
						"items": {
							"oneOf": [
								{ "type": "string", "minLength": 1 },
								{
									"type": "object",
									"additionalProperties": false,
									"required": ["name"],
									"properties": {
										"name": { "type": "string", "minLength": 1 },
										"columns": {
											"description": "Nº de columnas de la rejilla del grupo (1-3, default 1 = apilado). >1 colapsa a 1 columna en viewports estrechos.",
											"type": "integer",
											"minimum": 1,
											"maximum": 3
										},
										"placement": {
											"description": "Columna del editor donde se pinta el grupo: 'main' (central, el default) o 'aside' (columna lateral de tarjetas compactas, p. ej. publicación o portada).",
											"enum": ["main", "aside"]
										}
									}
								}
							]
						},
						"uniqueItems": true
					},
					"editorRail": {
						"description": "true ⇒ el editor de un registro pinta a su izquierda el raíl con los registros hermanos de la colección (la lista sigue presente mientras editas). Sin esta clave (o false), el editor no pinta raíl.",
						"type": "boolean"
					},
					"social": {
						"description": "Vista previa de tarjeta social (SEO/Open Graph): mapeo de qué campo de esta colección es el título/descripción/imagen social, más una plantilla de URL opcional (mismos placeholders {campo}/{id} que previewUrl; sin ella hereda el previewUrl del tipo). Cada clave es opcional y degrada por separado. Presente (aunque sea {}) activa la tarjeta en el aside del editor; sin esta clave, el editor no la pinta.",
						"type": "object",
						"additionalProperties": false,
						"properties": {
							"titleField": { "type": "string", "minLength": 1 },
							"descriptionField": { "type": "string", "minLength": 1 },
							"imageField": { "type": "string", "minLength": 1 },
							"urlTemplate": { "type": "string", "pattern": "^https?://" }
						}
					},
					"blocks": {
						"description": "Bloques ordenables embebidos: la colección hija cuyos registros son 'secciones' de este registro (p. ej. una landing hecha de bloques), el campo relation de esa hija que apunta de vuelta a este tipo y el campo numérico que los ordena. El editor pinta una lista embebida con crear/reordenar/plegar/borrar, sin salir del registro. Sin esta clave, el editor no pinta ninguna lista de bloques. typeField/dataField (opcionales, las DOS o ninguna) activan el modo HETEROGÉNEO: un campo de texto con el nombre de un blockTypes.<t> y un campo json con su contenido; sin ellas (o a medias), la colección hija sigue en modo homogéneo (una sola plantilla de bloque).",
						"type": "object",
						"additionalProperties": false,
						"required": ["collection", "parentField", "orderField"],
						"properties": {
							"collection": { "type": "string", "minLength": 1 },
							"parentField": { "type": "string", "minLength": 1 },
							"orderField": { "type": "string", "minLength": 1 },
							"typeField": { "type": "string", "minLength": 1 },
							"dataField": { "type": "string", "minLength": 1 }
						}
					},
					"page": {
						"description": "Modelo de páginas (tarea p1 1dc63001, el paso de 'editor de datos' a 'constructor de sitio'): declara que los registros de esta colección son páginas del sitio publicado. pathField (obligatorio) nombra la ruta pública (p. ej. /sobre-mi) y admite DOS formas: un campo text de esta colección (una ruta, el caso de siempre), o el nombre de un campo LÓGICO de localizedFields cuyas columnas físicas sean todas text (una ruta POR IDIOMA, sitio bilingüe) — Vega prueba primero la física y solo si no resuelve prueba la lógica. La unicidad la impone un índice UNIQUE real de PocketBase sobre cada columna implicada, que Vega solo comprueba y avisa si falta (uno por columna en el caso bilingüe). layoutField (opcional, nunca bilingüe) es un campo text que guarda el nombre de un layout de la raíz 'layouts'. Reusa slugField/statusField/social/previewUrl ya existentes: NO duplica publicación ni SEO, y pathField NUNCA se deriva de slugField. Sin esta clave, la colección no es de páginas.",
						"type": "object",
						"additionalProperties": false,
						"required": ["pathField"],
						"properties": {
							"pathField": { "type": "string", "minLength": 1 },
							"layoutField": { "type": "string", "minLength": 1 }
						}
					},
					"localizedFields": {
						"description": "Campos lógicos traducibles. Cada entrada mapea un mismo campo editorial a sus campos físicos por idioma.",
						"type": "object",
						"additionalProperties": {
							"type": "object",
							"additionalProperties": false,
							"required": ["fields"],
							"properties": {
								"label": { "type": "string", "minLength": 1, "maxLength": 60 },
								"fields": {
									"type": "object",
									"minProperties": 1,
									"propertyNames": { "pattern": "^[A-Za-z0-9_-]+$" },
									"additionalProperties": { "type": "string", "minLength": 1 }
								}
							}
						}
					},
					"fields": {
						"type": "object",
						"description": "Clave = nombre del campo en el backend.",
						"additionalProperties": {
							"type": "object",
							"additionalProperties": false,
							"properties": {
								"label": { "type": "string", "minLength": 1, "maxLength": 60 },
								"help": { "type": "string", "maxLength": 300 },
								"placeholder": { "type": "string", "maxLength": 120 },
								"order": { "type": "integer", "minimum": 0 },
								"group": { "type": "string", "minLength": 1 },
								"hidden": { "type": "boolean" },
								"widget": { "enum": ["textarea", "markdown"] },
								"listable": { "type": "boolean" }
							}
						}
					}
				}
			}
		},

		"revisions": {
			"description": "Historial de versiones y papelera (#lote-integridad, Fase B §7): activación y retención. Ausente ⇒ historial activo con los defaults (20 versiones por registro, papelera de 30 días) — un manifiesto que no declara esta clave no avisa de nada.",
			"type": "object",
			"additionalProperties": false,
			"properties": {
				"enabled": { "type": "boolean" },
				"keepPerRecord": { "type": "integer", "minimum": 0 },
				"trashDays": { "type": "integer", "minimum": 0 }
			}
		},

		"blockTypes": {
			"description": "Vocabulario de tipos de bloque del sitio (hero, texto, galería, cta…): la forma del mini-formulario que puede tomar un registro de una colección de bloques (collections.<c>.blocks.dataField) cuando su typeField vale la clave de este tipo. Clave = nombre del tipo de bloque; el patrón es estricto porque viaja al nombre de componente Astro y al documento de discovery del sitio.",
			"type": "object",
			"propertyNames": { "pattern": "^[a-z][a-z0-9-]*$" },
			"additionalProperties": {
				"type": "object",
				"additionalProperties": false,
				"required": ["label", "fields"],
				"properties": {
					"label": { "type": "string", "minLength": 1, "maxLength": 60 },
					"icon": { "type": "string", "minLength": 1 },
					"fields": {
						"description": "Campos del mini-formulario de este tipo de bloque, orden significativo (es el orden del formulario). Al menos uno.",
						"type": "array",
						"minItems": 1,
						"items": {
							"type": "object",
							"additionalProperties": false,
							"required": ["name", "label", "widget"],
							"properties": {
								"name": { "type": "string", "minLength": 1 },
								"label": { "type": "string", "minLength": 1, "maxLength": 60 },
								"widget": {
									"description": "Widget del campo. relation/file exigen source=record porque necesitan una columna real de PocketBase; unsupported queda fuera.",
									"enum": [
										"text",
										"textarea",
										"markdown",
										"richtext",
										"number",
										"switch",
										"email",
										"url",
										"datetime",
										"select",
										"chips",
										"relation",
										"file",
										"json"
									]
								},
								"source": {
									"description": "data (default) guarda el valor dentro del JSON del bloque; record lo lee de una columna real del registro hijo.",
									"enum": ["data", "record"]
								},
								"default": {
									"description": "Valor inicial aditivo para campos nuevos. Puede ser cualquier valor JSON."
								},
								"required": { "type": "boolean" },
								"relation": {
									"description": "Solo con widget relation (source record). Destino de la relación: cualquier colección, no solo vega_media. Ausente = contrato histórico (vega_media; múltiple si el campo se llama images).",
									"type": "object",
									"additionalProperties": false,
									"required": ["collection"],
									"properties": {
										"collection": { "type": "string", "minLength": 1 },
										"multiple": { "type": "boolean", "default": false },
										"thumbField": {
											"description": "Campo file de la colección destino del que sale la miniatura del selector y de los elegidos.",
											"type": "string",
											"minLength": 1
										},
										"filter": {
											"description": "Igualdades campo -> valor escalar unidas con AND; se aplican al listado y la búsqueda del selector, no a los ya elegidos.",
											"type": "object",
											"additionalProperties": {
												"anyOf": [{ "type": "string" }, { "type": "number" }, { "type": "boolean" }]
											}
										}
									}
								},
								"options": {
									"description": "Solo tiene efecto con widget select/chips.",
									"type": "array",
									"minItems": 1,
									"items": { "type": "string", "minLength": 1 }
								}
							},
							"allOf": [
								{
									"if": {
										"properties": { "widget": { "enum": ["relation", "file"] } },
										"required": ["widget"]
									},
									"then": {
										"properties": { "source": { "const": "record" } },
										"required": ["source"]
									}
								},
								{
									"if": { "properties": { "relation": true }, "required": ["relation"] },
									"then": {
										"properties": { "widget": { "const": "relation" } },
										"required": ["widget"]
									}
								}
							]
						}
					}
				}
			}
		},

		"layouts": {
			"description": "Vocabulario de plantillas de página del sitio (modelo de páginas, tarea p1 1dc63001): default, landing... El nombre de plantilla Astro que renderiza una página cuyo collections.<c>.page.layoutField vale esa clave. Clave = nombre de la plantilla; el patrón es estricto porque viaja al nombre de componente Astro, mismo motivo que blockTypes.",
			"type": "object",
			"propertyNames": { "pattern": "^[a-z][a-z0-9-]*$" },
			"additionalProperties": {
				"type": "object",
				"additionalProperties": false,
				"required": ["label"],
				"properties": {
					"label": { "type": "string", "minLength": 1, "maxLength": 60 },
					"icon": { "type": "string", "minLength": 1 }
				}
			}
		},

		"mergedViews": {
			"description": "Vistas fusionadas (L7a): unen registros de VARIAS colecciones bajo un id-slug. Clave = id-slug de la vista.",
			"type": "object",
			"additionalProperties": {
				"type": "object",
				"additionalProperties": false,
				"required": ["sources"],
				"properties": {
					"label": { "type": "string", "minLength": 1, "maxLength": 60 },
					"icon": { "type": "string", "minLength": 1 },
					"group": { "type": "string", "minLength": 1 },
					"order": { "type": "integer", "minimum": 0 },
					"orderField": {
						"description": "Nombre por defecto del campo NUMÉRICO de orden manual para las sources que no declaren el suyo propio.",
						"type": "string",
						"minLength": 1
					},
					"sources": {
						"description": "Contribución de cada colección a la vista: mínimo una.",
						"type": "array",
						"minItems": 1,
						"items": {
							"type": "object",
							"additionalProperties": false,
							"required": ["collection"],
							"properties": {
								"collection": { "type": "string", "minLength": 1 },
								"where": {
									"description": "Predicado de membresía: cada par es una condición 'eq'; varios pares se combinan en AND. Ausente u objeto vacío = toda la colección.",
									"type": "object",
									"additionalProperties": {
										"oneOf": [{ "type": "string" }, { "type": "number" }, { "type": "boolean" }]
									}
								},
								"orderField": {
									"description": "Campo NUMÉRICO de orden manual de esta source; si se omite, hereda el de la vista.",
									"type": "string",
									"minLength": 1
								},
								"titleField": {
									"description": "Override de la proyección de título para esta source.",
									"type": "string",
									"minLength": 1
								},
								"label": {
									"description": "Rótulo de la insignia de tipo para los registros de esta source.",
									"type": "string",
									"minLength": 1,
									"maxLength": 60
								}
							}
						}
					}
				}
			}
		}
	}
}
